{
  "$schema": "http://json-schema.org/draft-07/schema#",
  "$id": "https://simcore.io/api/specs/webserver/v0/components/schemas/project-v0.0.1.json",
  "title": "simcore project",
  "description": "Description of a simcore project",
  "type": "object",
  "additionalProperties": false,
  "required": [
    "uuid",
    "name",
    "description",
    "prjOwner",
    "accessRights",
    "creationDate",
    "lastChangeDate",
    "thumbnail",
    "workbench"
  ],
  "properties": {
    "uuid": {
      "type": "string",
      "description": "project unique identifier",
      "examples": [
        "07640335-a91f-468c-ab69-a374fa82078d",
        "9bcf8feb-c1b1-41b6-b201-639cd6ccdba8"
      ]
    },
    "name": {
      "type": "string",
      "description": "project name",
      "examples": [
        "Temporal Distortion Simulator"
      ]
    },
    "description": {
      "type": "string",
      "description": "longer one-line description about the project",
      "examples": [
        "Dabbling in temporal transitions ..."
      ]
    },
    "prjOwner": {
      "type": "string",
      "format": "idn-email",
      "description": "user email"
    },
    "accessRights": {
      "type": "object",
      "description": "object containing the GroupID as key and read/write/execution permissions as value",
      "additionalProperties": false,
      "patternProperties": {
        "^\\d+$": {
          "type": "object",
          "description": "the group id",
          "additionalProperties": false,
          "required": [
            "read",
            "write",
            "delete"
          ],
          "properties": {
            "read": {
              "type": "boolean",
              "description": "gives read access"
            },
            "write": {
              "type": "boolean",
              "description": "gives write access"
            },
            "delete": {
              "type": "boolean",
              "description": "gives deletion rights"
            }
          }
        }
      }
    },
    "creationDate": {
      "type": "string",
      "description": "project creation date",
      "pattern": "\\d{4}-(12|11|10|0?[1-9])-(31|30|[0-2]?\\d)T(2[0-3]|1\\d|0?[0-9])(:(\\d|[0-5]\\d)){2}(\\.\\d{3})?Z",
      "examples": [
        "2018-07-01T11:13:43Z"
      ]
    },
    "lastChangeDate": {
      "type": "string",
      "description": "last save date",
      "pattern": "\\d{4}-(12|11|10|0?[1-9])-(31|30|[0-2]?\\d)T(2[0-3]|1\\d|0?[0-9])(:(\\d|[0-5]\\d)){2}(\\.\\d{3})?Z",
      "examples": [
        "2018-07-01T11:13:43Z"
      ]
    },
    "thumbnail": {
      "type": "string",
      "description": "url of the latest screenshot of the project",
      "examples": [
        "https://placeimg.com/171/96/tech/grayscale/?0.jpg"
      ]
    },
    "workbench": {
      "type": "object",
      "patternProperties": {
        "^\\S+$": {
          "type": "object",
          "additionalProperties": false,
          "required": [
            "key",
            "version",
            "label",
            "position"
          ],
          "properties": {
            "key": {
              "type": "string",
              "description": "distinctive name for the node based on the docker registry path",
              "pattern": "^(simcore)/(services)(/demodec)?/(comp|dynamic|frontend)(/[^\\s/]+)+$",
              "examples": [
                "simcore/services/comp/sleeper",
                "simcore/services/dynamic/3dviewer",
                "simcore/services/frontend/file-picker"
              ]
            },
            "version": {
              "type": "string",
              "description": "semantic version number of the node",
              "pattern": "^(0|[1-9]\\d*)(\\.(0|[1-9]\\d*)){2}(-(0|[1-9]\\d*|\\d*[-a-zA-Z][-\\da-zA-Z]*)(\\.(0|[1-9]\\d*|\\d*[-a-zA-Z][-\\da-zA-Z]*))*)?(\\+[-\\da-zA-Z]+(\\.[-\\da-zA-Z-]+)*)?$",
              "examples": [
                "1.0.0",
                "0.0.1"
              ]
            },
            "label": {
              "type": "string"
            },
            "progress": {
              "type": "number",
              "maximum": 100,
              "minimum": 0,
              "description": "the node progress value"
            },
            "thumbnail": {
              "type": "string",
              "description": "url of the latest screenshot of the node",
              "examples": [
                "https://placeimg.com/171/96/tech/grayscale/?0.jpg"
              ]
            },
            "inputs": {
              "type": "object",
              "description": "values of input properties",
              "patternProperties": {
                "^[-_a-zA-Z0-9]+$": {
                  "oneOf": [
                    {
                      "type": [
                        "integer",
                        "boolean",
                        "string",
                        "number",
                        "null"
                      ]
                    },
                    {
                      "type": "object",
                      "additionalProperties": false,
                      "required": [
                        "nodeUuid",
                        "output"
                      ],
                      "properties": {
                        "nodeUuid": {
                          "type": "string"
                        },
                        "output": {
                          "type": "string"
                        }
                      }
                    },
                    {
                      "type": "object",
                      "additionalProperties": false,
                      "required": [
                        "store",
                        "path"
                      ],
                      "properties": {
                        "store": {
                          "type": [
                            "string",
                            "integer"
                          ]
                        },
                        "dataset": {
                          "type": "string"
                        },
                        "path": {
                          "type": "string"
                        },
                        "label": {
                          "type": "string"
                        }
                      }
                    }
                  ]
                }
              }
            },
            "inputAccess": {
              "description": "map with key - access level pairs",
              "type": "object",
              "patternProperties": {
                "^[-_a-zA-Z0-9]+$": {
                  "type": "string",
                  "enum": [
                    "Invisible",
                    "ReadOnly",
                    "ReadAndWrite"
                  ],
                  "default": "ReadAndWrite",
                  "examples": [
                    "ReadOnly"
                  ]
                }
              }
            },
            "inputNodes": {
              "type": "array",
              "items": {
                "type": "string",
                "pattern": "^\\S+$"
              },
              "description": "node IDs of where the node is connected to",
              "examples": [
                "nodeUuid1",
                "nodeUuid2"
              ]
            },
            "outputs": {
              "type": "object",
              "patternProperties": {
                "^[-_a-zA-Z0-9]+$": {
                  "oneOf": [
                    {
                      "type": [
                        "integer",
                        "boolean",
                        "string",
                        "number",
                        "null"
                      ]
                    },
                    {
                      "type": "object",
                      "additionalProperties": false,
                      "required": [
                        "store",
                        "path"
                      ],
                      "properties": {
                        "store": {
                          "type": [
                            "string",
                            "integer"
                          ]
                        },
                        "dataset": {
                          "type": "string"
                        },
                        "path": {
                          "type": "string"
                        },
                        "label": {
                          "type": "string"
                        }
                      }
                    }
                  ]
                }
              }
            },
            "outputNode": {
              "type": "boolean",
              "deprecated": true
            },
            "outputNodes": {
              "type": "array",
              "items": {
                "type": "string",
                "pattern": "^\\S+$"
              },
              "description": "Used in group-nodes. Node IDs of those connected to the output",
              "examples": [
                "nodeUuid1",
                "nodeUuid2"
              ]
            },
            "parent": {
              "type": [
                "string",
                "null"
              ],
              "pattern": "^\\S+$",
              "description": "Parent's (group-nodes') node ID s.",
              "examples": [
                "nodeUuid1",
                "nodeUuid2"
              ]
            },
            "position": {
              "type": "object",
              "additionalProperties": false,
              "required": [
                "x",
                "y"
              ],
              "properties": {
                "x": {
                  "type": "integer"
                },
                "y": {
                  "type": "integer"
                }
              }
            }
          }
        }
      }
    },
    "tags": {
      "type": "array",
      "items": {
        "type": "integer"
      }
    },
    "dev": {
      "type": "object",
      "description": "object used for development purposes only"
    }
  }
}
