  {
    "uuid": "de2578c5-431e-1234-a1a7-f7d4f3a8f26b",
    "name": "ISAN: UCDavis use case: 0D",
    "description": "Colleen Clancy Single Cell solver with a file picker and PostPro viewer",
    "thumbnail": "https://placeimg.com/171/96/tech/grayscale/?18.jpg",
    "prjOwner": "foo@foo.com",
    "creationDate": "2018-10-22T09:13:13.360Z",
    "lastChangeDate": "2018-10-22T09:33:41.858Z",
    "tags": [],
    "accessRights": {},
    "workbench": {
      "de2578c5-431e-4674-b758-946151cae351": {
        "key": "simcore/services/frontend/file-picker",
        "version": "1.0.0",
        "label": "File Picker 0D",
        "inputs": {},
        "inputNodes": [],
        "outputs": {
          "outFile": {
            "store": 1,
            "path": "Shared Data/initial_WStates"
          }
        },
        "progress": 100,
        "position": {
          "x": 50,
          "y": 150
        }
      },
      "de2578c5-431e-409d-998c-c1f04de67f8b": {
        "key": "simcore/services/comp/ucdavis-singlecell-cardiac-model",
        "version": "1.0.0",
        "label": "DBP-Clancy-Rabbit-Single-Cell solver",
        "inputAccess": {
          "Na": "ReadAndWrite",
          "Kr": "ReadOnly",
          "BCL": "ReadAndWrite",
          "NBeats": "ReadOnly",
          "Ligand": "Invisible",
          "cAMKII": "Invisible"
        },
        "inputs": {
          "Na": 0,
          "Kr": 0,
          "BCL": 200,
          "NBeats": 5,
          "Ligand": 0,
          "cAMKII": "WT",
          "initfile": {
            "nodeUuid": "de2578c5-431e-4674-b758-946151cae351",
            "output": "outFile"
          }
        },
        "inputNodes": [
          "de2578c5-431e-4674-b758-946151cae351"
        ],
        "outputs": {},
        "position": {
          "x": 300,
          "y": 150
        }
      },
      "de2578c5-431e-43e7-9fda-cf9625e59986": {
        "key": "simcore/services/dynamic/cc-0d-viewer",
        "version": "2.8.0",
        "label": "cc-0d-viewer",
        "inputs": {
          "vm_1Hz": {
            "nodeUuid": "de2578c5-431e-409d-998c-c1f04de67f8b",
            "output": "out_4"
          },
          "all_results_1Hz": {
            "nodeUuid": "de2578c5-431e-409d-998c-c1f04de67f8b",
            "output": "out_1"
          }
        },
        "inputNodes": [
          "de2578c5-431e-409d-998c-c1f04de67f8b"
        ],
        "outputs": {},
        "position": {
          "x": 550,
          "y": 150
        }
      }
    }
  }
