[
  {
    "uuid": "5a6d7f24-ee9a-4112-bca2-85a8ca49234a",
    "name": "ISAN2019: 3D Paraview",
    "description": "3D Paraview viewer with two inputs",
    "thumbnail": "https://user-images.githubusercontent.com/33152403/60168939-073a5580-9806-11e9-8dad-8a7caa3eb5ab.png",
    "prjOwner": "",
    "creationDate": "2019-06-06 14:33:43.065",
    "lastChangeDate": "2019-06-06 14:33:44.747",
    "accessRights": {},
    "workbench": {
      "de2578c5-431e-5753-af37-e6aec8120bf2": {
        "key": "simcore/services/frontend/file-picker",
        "version": "1.0.0",
        "label": "File Picker 1",
        "inputs": {},
        "inputNodes": [],
        "outputs": {
          "outFile": {
            "store": 1,
            "path": "Shared Data/HField_Big.vtk"
          }
        },
        "progress": 100,
        "position": {
          "x": 100,
          "y": 100
        }
      },
      "de2578c5-431e-522c-a377-dd8d7cd1265b": {
        "key": "simcore/services/frontend/file-picker",
        "version": "1.0.0",
        "label": "File Picker 2",
        "inputs": {},
        "inputNodes": [],
        "outputs": {
          "outFile": {
            "store": 1,
            "path": "Shared Data/bunny.vtk"
          }
        },
        "progress": 100,
        "position": {
          "x": 100,
          "y": 250
        }
      },
      "de2578c5-431e-9b0f-67677a20996c": {
        "key": "simcore/services/dynamic/3d-viewer",
        "version": "2.10.0",
        "label": "3D ParaViewer",
        "inputs": {
          "A": {
            "nodeUuid": "de2578c5-431e-5753-af37-e6aec8120bf2",
            "output": "outFile"
          },
          "B": {
            "nodeUuid": "de2578c5-431e-522c-a377-dd8d7cd1265b",
            "output": "outFile"
          }
        },
        "inputNodes": [
          "de2578c5-431e-5753-af37-e6aec8120bf2",
          "de2578c5-431e-522c-a377-dd8d7cd1265b"
        ],
        "outputs": {},
        "progress": 85,
        "position": {
          "x": 400,
          "y": 175
        }
      }
    }
  },
  {
    "uuid": "de2578c5-431e-5d82-b08d-d39c436ca738",
    "name": "ISAN: UCDavis use case: 0D",
    "description": "Colleen Clancy Single Cell solver with a file picker and PostPro viewer",
    "thumbnail": "https://user-images.githubusercontent.com/33152403/60168940-073a5580-9806-11e9-9a44-ae5266eeb020.png",
    "prjOwner": "",
    "creationDate": "2019-06-06 14:33:51.94",
    "lastChangeDate": "2019-06-06 14:33:54.329",
    "accessRights": {},
    "workbench": {
      "de2578c5-431e-59d6-b1a5-6e7b2773636b": {
        "key": "simcore/services/frontend/file-picker",
        "version": "1.0.0",
        "label": "File Picker 0D",
        "inputs": {},
        "inputNodes": [],
        "outputs": {
          "outFile": {
            "store": 1,
            "path": "Shared Data/initial_WStates"
          }
        },
        "progress": 100,
        "position": {
          "x": 50,
          "y": 150
        }
      },
      "de2578c5-431e-562f-afd1-cca5105c8844": {
        "key": "simcore/services/comp/ucdavis-singlecell-cardiac-model",
        "version": "1.0.0",
        "label": "DBP-Clancy-Rabbit-Single-Cell solver",
        "inputs": {
          "Na": 0,
          "Kr": 0,
          "BCL": 200,
          "NBeats": 5,
          "Ligand": 0,
          "cAMKII": "WT",
          "initfile": {
            "nodeUuid": "de2578c5-431e-59d6-b1a5-6e7b2773636b",
            "output": "outFile"
          }
        },
        "inputAccess": {
          "Na": "ReadAndWrite",
          "Kr": "ReadOnly",
          "BCL": "ReadAndWrite",
          "NBeats": "ReadOnly",
          "Ligand": "Invisible",
          "cAMKII": "Invisible"
        },
        "inputNodes": [
          "de2578c5-431e-59d6-b1a5-6e7b2773636b"
        ],
        "outputs": {},
        "progress": 0,
        "position": {
          "x": 300,
          "y": 150
        }
      },
      "de2578c5-431e-5fdd-9daa-cb03c51d8138": {
        "key": "simcore/services/dynamic/cc-0d-viewer",
        "version": "2.8.0",
        "label": "cc-0d-viewer",
        "inputs": {
          "vm_1Hz": {
            "nodeUuid": "de2578c5-431e-562f-afd1-cca5105c8844",
            "output": "out_4"
          },
          "all_results_1Hz": {
            "nodeUuid": "de2578c5-431e-562f-afd1-cca5105c8844",
            "output": "out_1"
          }
        },
        "inputNodes": [
          "de2578c5-431e-562f-afd1-cca5105c8844"
        ],
        "outputs": {},
        "progress": 20,
        "position": {
          "x": 550,
          "y": 150
        }
      }
    }
  }
]
