{
  "uuid": "de2578c5-431e-4537-9f2d-2fbcbee4afb1",
  "name": "NIH SPARC Hackathon 2018",
  "description": "NIH SPARC Hackathon 2018 template consisting of a FilePicker, and two notebooks",
  "thumbnail": "https://placeimg.com/171/96/tech/grayscale/?18.jpg",
  "prjOwner": "foo@foo.com",
  "creationDate": "2018-12-05T21:13:13.360Z",
  "lastChangeDate": "2018-12-05T21:13:13.360Z",
  "accessRights": {},
  "workbench": {
    "de2578c5-431e-4261-b92f-7343aecaab44": {
      "key": "simcore/services/frontend/file-picker",
      "version": "1.0.0",
      "label": "File Picker",
      "inputs": {},
      "inputNodes": [],
      "outputs": {},
      "parent": null,
      "position": {
        "x": 50,
        "y": 150
      }
    },
    "de2578c5-431e-49b0-968d-a6545f9dc878": {
      "key": "simcore/services/dynamic/jupyter-scipy-notebook",
      "version": "1.7.0",
      "label": "Jupyter SciPy notebook",
      "inputs": {
        "input_1": {
          "nodeUuid": "de2578c5-431e-4261-b92f-7343aecaab44",
          "output": "outFile"
        }
      },
      "inputNodes": [
        "de2578c5-431e-4261-b92f-7343aecaab44"
      ],
      "outputs": {},
      "parent": null,
      "position": {
        "x": 300,
        "y": 150
      }
    },
    "de2578c5-431e-4a0e-bf7e-abad5e22e054": {
      "key": "simcore/services/dynamic/jupyter-base-notebook",
      "version": "1.7.0",
      "label": "Jupyter base notebook",
      "inputs": {
        "input_1": {
          "nodeUuid": "de2578c5-431e-49b0-968d-a6545f9dc878",
          "output": "output_1"
        }
      },
      "inputNodes": [
        "de2578c5-431e-49b0-968d-a6545f9dc878"
      ],
      "outputs": {},
      "parent": null,
      "position": {
        "x": 550,
        "y": 150
      }
    }
  }
}
